{
  "$schema": "https://json-schema.org/draft/2020-12/schema",
  "$id": "https://github.com/SamuelBrudner/autoencoded-vocal-analysis/contracts/ava_latent_sequence_v1/metadata.schema.json",
  "title": "AVA latent sequence v1 metadata",
  "type": "object",
  "required": [
    "schema_version",
    "created_utc",
    "clip_id",
    "recording_id",
    "bird_id",
    "dph",
    "regime",
    "tutor_start_dph",
    "audio_path",
    "audio_sha256",
    "sample_rate_hz"
  ],
  "properties": {
    "schema_version": {
      "const": "ava_latent_sequence_v1"
    },
    "created_utc": {
      "type": "string",
      "format": "date-time"
    },
    "clip_id": {
      "type": "string",
      "minLength": 1
    },
    "recording_id": {
      "oneOf": [
        {
          "type": "string",
          "minLength": 1
        },
        {
          "type": "null"
        }
      ]
    },
    "bird_id": {
      "oneOf": [
        {
          "type": "string",
          "minLength": 1
        },
        {
          "type": "null"
        }
      ]
    },
    "dph": {
      "oneOf": [
        {
          "type": "number",
          "minimum": 0
        },
        {
          "type": "null"
        }
      ]
    },
    "regime": {
      "oneOf": [
        {
          "type": "string",
          "minLength": 1
        },
        {
          "type": "null"
        }
      ]
    },
    "tutor_start_dph": {
      "oneOf": [
        {
          "type": "number",
          "minimum": 0
        },
        {
          "type": "null"
        }
      ]
    },
    "audio_path": {
      "type": "string",
      "minLength": 1,
      "not": {
        "pattern": "^(?:/|file://|[A-Za-z]:[\\\\/])"
      }
    },
    "audio_sha256": {
      "oneOf": [
        {
          "type": "string",
          "pattern": "^[0-9a-f]{64}$"
        },
        {
          "type": "null"
        }
      ]
    },
    "sample_rate_hz": {
      "oneOf": [
        {
          "type": "integer",
          "minimum": 1
        },
        {
          "type": "null"
        }
      ]
    }
  },
  "additionalProperties": true
}
